{
  "is_recruitment_email": true,
  "email_type": "candidate_recommendation",
  "sender": {
    "name": "유민정",
    "email": "minjeong.yoo@jac-recruitment.kr",
    "company": "JAC Recruitment Korea",
    "role": null
  },
  "recipient": {
    "name": "최은하",
    "email": "eh.choi@chemi-kor.co.kr",
    "company": "케미콘일렉트로닉스코리아",
    "role": "담당자"
  },
  "hiring_company": "케미콘일렉트로닉스코리아",
  "position": "영업",
  "candidates": [
    {
      "name": "김대호",
      "birth_year": 1997,
      "age": 29,
      "education": [{"school": "레이타쿠대학교", "major": null, "degree": null}],
      "career": [
        {"company": "한국 연구회사", "department": null, "duration_years": 2, "description": "사무직"},
        {"company": null, "department": null, "duration_years": 1, "description": "일본 무역사무"}
      ],
      "languages": ["일본어"],
      "strengths": [],
      "certifications": ["운전면허"],
      "notes": null
    },
    {
      "name": "이영희",
      "birth_year": 1995,
      "age": 31,
      "education": [{"school": "연세대학교", "major": "경영학과", "degree": null}],
      "career": [
        {"company": "LG전자", "department": "영업기획팀", "duration_years": 3, "description": null},
        {"company": "삼성SDS", "department": null, "duration_years": 2, "description": "B2B 영업"}
      ],
      "languages": ["영어", "일본어"],
      "strengths": [],
      "certifications": [],
      "notes": null
    },
    {
      "name": "박철수",
      "birth_year": 1990,
      "age": 36,
      "education": [
        {"school": "고려대학교", "major": "화학공학과", "degree": "학사"},
        {"school": "고려대학교", "major": "화학공학과", "degree": "석사"}
      ],
      "career": [
        {"company": "SK이노베이션", "department": null, "duration_years": 5, "description": "해외영업"},
        {"company": "LG화학", "department": "글로벌영업팀", "duration_years": 3, "description": null}
      ],
      "languages": ["영어", "중국어", "일본어"],
      "strengths": ["화학 산업 도메인 지식", "글로벌 네트워크"],
      "certifications": [],
      "notes": null
    }
  ],
  "process_status": null,
  "has_attachment": true,
  "deadline": "이번 주 금요일",
  "raw_notes": null
}
