{
  "is_recruitment_email": true,
  "email_type": "interview_schedule",
  "sender": {
    "name": "유민정",
    "email": null,
    "company": "JAC Recruitment Korea",
    "role": null
  },
  "recipient": {
    "name": "최은하",
    "email": null,
    "company": null,
    "role": "담당자"
  },
  "hiring_company": null,
  "position": null,
  "candidates": [
    {
      "name": "김대호",
      "birth_year": null,
      "age": null,
      "education": [],
      "career": [],
      "languages": [],
      "strengths": [],
      "certifications": [],
      "notes": null
    }
  ],
  "process_status": {
    "stage": "first_interview",
    "result": "pending",
    "next_step": "1차 면접 확정",
    "schedule": {
      "date": "다음 주 화요일",
      "time": "14:00",
      "location": null
    }
  },
  "has_attachment": false,
  "deadline": null,
  "raw_notes": "후보자에게 안내 예정"
}
