{
  "is_recruitment_email": true,
  "email_type": "inquiry",
  "sender": {
    "name": "유민정",
    "email": null,
    "company": "JAC Recruitment",
    "role": null
  },
  "recipient": {
    "name": "최은하",
    "email": null,
    "company": null,
    "role": "담당자"
  },
  "hiring_company": null,
  "position": "영업",
  "candidates": [],
  "process_status": null,
  "has_attachment": false,
  "deadline": null,
  "raw_notes": "희망 연차, 외국어 필수 여부, 출장 빈도 문의"
}
